{
  "$schema": "https://json-schema.org/draft/2020-12/schema",
  "$id": "https://sectrace.local/skills/intake/1.0.0/input.schema.json",
  "title": "SecTrace Intake Skill input",
  "type": "object",
  "required": ["scenario_id", "real_data", "events", "expected"],
  "properties": {
    "scenario_id": {"type": "string", "pattern": "^[A-Za-z0-9][A-Za-z0-9_-]{0,63}$"},
    "title": {"type": "string", "minLength": 1, "maxLength": 256},
    "real_data": {"const": false},
    "events": {"type": "array", "minItems": 1, "maxItems": 16, "items": {"$ref": "#/$defs/event"}},
    "expected": {"$ref": "#/$defs/expected"}
  },
  "additionalProperties": false,
  "$defs": {
    "event": {
      "type": "object", "required": ["event_ref", "event_type", "at", "subject"],
      "properties": {
        "event_ref": {"type": "string", "pattern": "^[A-Za-z0-9][A-Za-z0-9_.:-]{0,127}$"},
        "event_type": {"enum": ["anomalous_login", "privilege_elevation", "bulk_sensitive_data_access"]},
        "at": {"type": "string", "format": "date-time", "pattern": "^\\d{4}-\\d{2}-\\d{2}T\\d{2}:\\d{2}:\\d{2}Z$"},
        "region_label": {"type": "string", "minLength": 1, "maxLength": 128},
        "subject": {"type": "string", "minLength": 1, "maxLength": 256},
        "record_count": {"type": "integer", "minimum": 0, "maximum": 1000000},
        "note": {"type": "string", "minLength": 1, "maxLength": 512}
      }, "additionalProperties": false
    },
    "expected": {
      "type": "object",
      "properties": {
        "intake": {"enum": ["accept", "reject"]}, "severity_hint": {"enum": ["low", "medium", "high"]},
        "risk_path": {"type": "array", "maxItems": 16, "items": {"type": "string", "pattern": "^[A-Za-z0-9][A-Za-z0-9_.:-]{0,127}$"}},
        "response_status": {"enum": ["draft", "pending_approval", "executed"]}, "requires_approval": {"type": "boolean"},
        "classification": {"enum": ["inference", "unknown"]}, "evidence_level": {"const": "insufficient"},
        "conclusion": {"type": "string", "minLength": 1, "maxLength": 512},
        "reason": {"enum": ["invalid_timestamp", "missing_required_event_type", "real_data_marker", "unsupported_event_type"]},
        "risk_level": {"enum": ["low", "medium", "high"]}, "contract": {"const": "reject"},
        "approval_status": {"const": "rejected"}, "audit": {"enum": ["integrity_check", "missing_requirements", "redact"]},
        "missing_requirement": {"enum": ["approval", "evidence"]},
        "report_contains": {"type": "string", "minLength": 1, "maxLength": 512}, "report_excludes": {"type": "string", "minLength": 1, "maxLength": 512},
        "tampered_hash": {"const": "reject"}, "valid_replay": {"const": "stable"}
      }, "additionalProperties": false
    }
  }
}
