{
  "scenario_id": "S15",
  "title": "Synthetic medium-risk data-review event",
  "real_data": false,
  "events": [{"event_ref": "evt_s15_001", "event_type": "bulk_sensitive_data_access", "at": "2026-08-04T13:20:00Z", "subject": "synthetic-user-o", "record_count": 12}],
  "expected": {"intake": "accept", "risk_level": "medium", "requires_approval": false, "response_status": "draft"}
}
