{
  "scenario_id": "S04",
  "title": "Synthetic bulk sensitive-data access event",
  "real_data": false,
  "events": [{"event_ref": "evt_s04_001", "event_type": "bulk_sensitive_data_access", "at": "2026-08-04T10:20:00Z", "subject": "synthetic-user-d", "record_count": 180}],
  "expected": {"intake": "accept", "severity_hint": "medium", "classification": "inference"}
}
