{
  "scenario_id": "S23",
  "title": "Audit redacts synthetic sensitive string",
  "real_data": false,
  "events": [{"event_ref": "evt_s23_001", "event_type": "anomalous_login", "at": "2026-08-04T15:20:00Z", "region_label": "foreign-region", "subject": "synthetic-user-w", "note": "API_KEY=synthetic-redaction-value"}],
  "expected": {"audit": "redact", "report_contains": "[REDACTED]", "report_excludes": "synthetic-redaction-value"}
}
