{
  "scenario_id": "S21",
  "title": "Audit flags missing high-risk evidence",
  "real_data": false,
  "events": [{"event_ref": "evt_s21_001", "event_type": "anomalous_login", "at": "2026-08-04T15:00:00Z", "region_label": "foreign-region", "subject": "synthetic-user-u"}],
  "expected": {"audit": "missing_requirements", "missing_requirement": "evidence"}
}
