{
  "scenario_id": "S01",
  "title": "Synthetic anomalous foreign-region login to privileged bulk data access",
  "real_data": false,
  "events": [
    {"event_ref": "evt_s01_001", "event_type": "anomalous_login", "at": "2026-08-04T09:00:00Z", "region_label": "foreign-region", "subject": "synthetic-user-a"},
    {"event_ref": "evt_s01_002", "event_type": "privilege_elevation", "at": "2026-08-04T09:04:00Z", "subject": "synthetic-user-a"},
    {"event_ref": "evt_s01_003", "event_type": "bulk_sensitive_data_access", "at": "2026-08-04T09:07:00Z", "subject": "synthetic-user-a", "record_count": 240}
  ],
  "expected": {"intake": "accept", "severity_hint": "high", "risk_path": ["evt_s01_001", "evt_s01_002", "evt_s01_003"], "response_status": "pending_approval", "requires_approval": true}
}
